{
  "schema_version": 1,
  "diagram_type": "sequence",
  "meta": {
    "title": "Short polling",
    "output": "short-polling.html",
    "viewBox": [
      1200,
      760
    ],
    "animation": "trace",
    "quality_profile": "showcase",
    "column_fit": "spread",
    "node_icon_layout": "stacked"
  },
  "participants": [
    {
      "id": "browser",
      "type": "frontend",
      "label": "Browser"
    },
    {
      "id": "server",
      "type": "backend",
      "label": "Server"
    }
  ],
  "messages": [
    {
      "id": "req-1",
      "from": "browser",
      "to": "server",
      "y": 200,
      "label": "request",
      "variant": "default"
    },
    {
      "id": "res-1",
      "from": "server",
      "to": "browser",
      "y": 240,
      "label": "empty response",
      "variant": "return"
    },
    {
      "id": "req-2",
      "from": "browser",
      "to": "server",
      "y": 320,
      "label": "request",
      "variant": "default"
    },
    {
      "id": "res-2",
      "from": "server",
      "to": "browser",
      "y": 360,
      "label": "empty response",
      "variant": "return"
    },
    {
      "id": "req-3",
      "from": "browser",
      "to": "server",
      "y": 440,
      "label": "request",
      "variant": "default"
    },
    {
      "id": "res-3",
      "from": "server",
      "to": "browser",
      "y": 480,
      "label": "empty response",
      "variant": "return"
    },
    {
      "id": "req-4",
      "from": "browser",
      "to": "server",
      "y": 560,
      "label": "request",
      "variant": "default"
    },
    {
      "id": "res-4",
      "from": "server",
      "to": "browser",
      "y": 610,
      "label": "new data",
      "variant": "emphasis"
    }
  ]
}
