{
  "schema_version": 1,
  "diagram_type": "sequence",
  "meta": {
    "title": "Rate limit: 420 của Twitter thành 429 chuẩn",
    "output": "status-420-429.html",
    "viewBox": [
      1200,
      760
    ],
    "animation": "trace",
    "quality_profile": "showcase",
    "column_fit": "spread",
    "node_icon_layout": "stacked"
  },
  "participants": [
    {
      "id": "client",
      "type": "frontend",
      "label": "Client"
    },
    {
      "id": "api",
      "type": "backend",
      "label": "Twitter API"
    }
  ],
  "messages": [
    {
      "id": "req-v1",
      "from": "client",
      "to": "api",
      "y": 230,
      "label": "nhiều request (API v1)",
      "variant": "default"
    },
    {
      "id": "res-420",
      "from": "api",
      "to": "client",
      "y": 320,
      "label": "420 Enhance Your Calm",
      "variant": "security"
    },
    {
      "id": "req-v11",
      "from": "client",
      "to": "api",
      "y": 440,
      "label": "nhiều request (API v1.1)",
      "variant": "default"
    },
    {
      "id": "res-429",
      "from": "api",
      "to": "client",
      "y": 530,
      "label": "429 Too Many Requests",
      "variant": "emphasis"
    }
  ]
}