{
  "schema_version": 1,
  "diagram_type": "sequence",
  "meta": {
    "title": "451: server trung gian từ chối vì yêu cầu pháp lý",
    "output": "status-451.html",
    "viewBox": [
      1200,
      760
    ],
    "animation": "trace",
    "quality_profile": "showcase",
    "column_fit": "spread",
    "node_icon_layout": "stacked"
  },
  "participants": [
    {
      "id": "browser",
      "type": "frontend",
      "label": "Browser"
    },
    {
      "id": "middle",
      "type": "security",
      "label": "Server trung gian"
    },
    {
      "id": "origin",
      "type": "backend",
      "label": "Server gốc",
      "note": "Ví dụ này: request bị chặn ở bên trung gian nên server gốc không tham gia."
    }
  ],
  "messages": [
    {
      "id": "req",
      "from": "browser",
      "to": "middle",
      "y": 250,
      "label": "GET /bai-viet",
      "variant": "emphasis"
    },
    {
      "id": "res-451",
      "from": "middle",
      "to": "browser",
      "y": 400,
      "label": "451 Unavailable For Legal Reasons",
      "variant": "security"
    },
    {
      "id": "res-body",
      "from": "middle",
      "to": "browser",
      "y": 550,
      "label": "body: ai yêu cầu chặn, theo luật nào",
      "variant": "return"
    }
  ]
}